"","Title","Name","Rating","DateReview","TextReview","TitleReview"
"87","Dune: Part Two","Sleepin_Dragon","10/10","29 February 2024","Paul has to prove himself to both Chani and The Fremen, his dreams become more vivid, one path leads to destruction, maybe even the loss of Chani.I don't think I've anticipated a film quite so much as this, since being spellbound by the first, I counted down the days for this follow up, and by chance got to see it a day early.In one single word, captivating, the best film I've seen in a very long time, absolutely wonderful from start to finish, the character development, visuals, music, action sequences are all tremendous.We get to see Paul growing before our very eyes, the character at the end of the film is very different to the one at the start, the best yet from Chalamet, he shows a degree of grit.A special mention about the performance of Austin Butler, I thought he was incredibly good as Feyd Rauth, what a menacing villain, one of those that had you wondering about what he'd do next, and that makeup, awesome.I can't fault a single performance, inspired casting, backed up by a marvellous script.The music is spot on once again, I instantly wanted to download Ripples in The sand and Paul's Dream once again.Incredible visuals, from the amazing location work, to the creative camera work, and the jaw dropping special effects.I thought this was going to be the toughest movie of the franchise, as so much happens at the start and the finish, it wasn't the case, this was a fabulous movie.10/10."," Solid cheese"
"88","Dune: Part Two","geotech-27507","8/10","2 March 2024","As with the first film, the production was beautiful. I loved the opening scenes with the Harkonnen soldiers. The arena fight between Austin Butler and the last Atreides Robert Yuan (actors names) was fantastic. The battles with the harvesters were phenomenal.The script, however, left me a little bit disappointed. What about the Guild Navigators? And how were the worms used after they came through the pass in the mountains opened up by the atomics? There was only one sequence of the initial charge (marvelous sequence when the gunships entered) but then nothing. The Sardurkar were not given enough respect in this film. There was only one scene that showed them respect and that was when they rose up from the fallen sand and rock debris and stood their ground preparing for the oncoming onslaught instead of panicking. Other than that I felt the film should have spent more time on tactical combat scenes in what was supposed to be an epic battle at the end of the film, maybe trim time off of the other dragged out sequences in the film. The first movie did a better job with the Sardaukar, you actually feared them. The epic battle at the end of this movie was less than epic. And poor Bautista, they should not have made him act like such a wimp, should have had a more glorious fight even in retreat.As much as I like Walken, I thought he was poorly cast to be Emperor. The 1984 film had a perfect actor for the personality. This is Villeneuve's fault, he picked him.The script also fails to emphasize that Paul is the Kwisatz Haderach at the end of the movie. Paul's initial ability to vaguely see the future comes from the centuries of genetic tinkering of the women of the Ben Gesserat, but after he drinks the water of life and not only survives but develops the ability to see an individual's past, as evident by the scenes in the Fremen temple where he looks at individuals and describes their past, and more clearly sees optional future outcomes, and after he actually fulfills all of the prophecies of the Fremen, the story is true, he really is the Messiah of Arrakis, justifying the religion, and he really is the Kwisatz Haderach, a man with abilities that no other man has. But the film appears to gloss over this. Shame. He is not just some populist charismatic man blamed by the likes of Zendaya's character for (perceived) fooling anyone to follow him and falling for the appeal of power and giving up his principles, he is more than that.My critique of the first film was not enough emotion, well part 2 does a better job, especially after Paul survives the water of life and becomes the anti-hero, all hell breaks loose. And Zendaya's character being a more independent women than the 1984 film was interesting, albeit the combat skills or luck were not realistic unless you buy that the Sardaukar were that inept. Part 1 was a better drama than part 2, but part 2 has some great action sequences, besides the disappointments I mentioned earlier. Not a perfect film for this Dune 1984 admirer."," An entertaining joy ride"
"89","Dune: Part Two","euricodcosta","10/10","28 February 2024","As an avid movie fan I see plenty of movies, many average, many bad, a few good and once in while great. But I use the word great scarcely. Dune 2 is better than great. Oppenheimer was a great movie but I wouldn't rush back to see it a second time in the near future. Dune 2, I would see it again tomorrow. The story is on par to the Star Wars legacy, the acting, on par with Oppenheimer, the SFX better than the two movies just mentioned combined. When the movie finished (over 2 and half hours) I still wanted more. The emotional ride was like nothing I can remember from ANY movie I can remember. Best movie of the year? I don't think so, best movie of a generation is more akin to what I saw. Wish I could give it 11 stars."," Popcorn movie"
"90","Dune: Part Two","christianreedbrown-65145","10/10","26 February 2024","I just got out of an early access showing and it was absolutely incredible. See for yourself in IMAX. The characters, acting, screenplay, world building, storytelling, score, actions sequences, cinematography, and everything in between make for a cinematic masterpiece. Denis Villeneuve provides a masterclass of filmmaking. The casting continuation was perfect all the way through, with great new add-ons. Timothee Chalamet is believable, raw and real as Paul Atriedes. He was flawless as the lead. Zendaya, Rebecca Ferguson, Javier Bardem, and Josh Brolin are fantastic per usual. Stellan Skarsgard and Dave Bautista continue their evil. Austin Butler steals the show as Feyd-Rautha, and Florence Pugh and Christopher Walken are solid fresh casts.Overall, Dune: Part Two is an inspiring, visually stunning sci-fi spectacle and an incredible collision of myth, adventure, and destiny on a galactic scale. It's a fantastic piece of filmmaking, rarely seen in modern day cinema."," The 2024 version is almost as good as the 1998 version."
"91","Dune: Part Two","nickventura-98896","9/10","26 February 2024","Saw an early screening of this film at the Tilton Square Theatre in New Jersey, and I was completely blown away. From the opening scene all the way until the credits I never felt bored, which is impressive for a 2 hour and 45 minute film.I don't want to write too much here, I prefer anyone reading this with the slightest bit of interest in the film to go see it immediately. It doesn't release worldwide until March 1st, so grab tickets and I would highly recommended you see it in IMAX if possible. Almost the entirety of the movie is filmed with IMAX cameras.This movie is an absolute visual spectacle probably going to win a couple Oscar's for sound editing, picture, etc., and the fight scenes are choreographed so fantastically. Like I stated in the beginning, see this film!"," All these Conor-hatin Cry babies up in here lol"
"92","Dune: Part Two","elijahbutler-40119","10/10","26 February 2024","Dune: Part Two is simply Denis Villeneuve's Magnum Opus in his filmography. I've loved this director's work since ""Blade Runner 2049"", and ""Arrival"". He did an excellent job placing his vision on the first Dune, but here, Villeneuve cranks his direction times 10!The structure, set-up, visuals, sound and story are crafted in ways that are hard for me to put in words, due to how everything came together so miraculously. The acting is also top-notch! Timothe Chalamet in particular is unbelievably phenomenal, and Zendaya does a great job as well. Austin Butler, Rebecca Ferguson and Florence Pugh are also excellent! Denis never lets you out of this experience! The pure weight of the film is presented through astounding narratives, rich cinematography, an epic story and mesmerizing action sequences that will make your seat rumble if you watch this on the big screen!There are quite a handful of thrilling moments that I still have no idea how they came out THIS good in the end! Denis Villeneuve is truly a sorcerer in the Sci-Fi genre! Every frame and detail in his films are captivating as hell, and it's no different here in the slightest!Dune: Part Two made me leave the theater feeling inspired! There's so much to take away from this masterpiece! Definitely my #1 favorite movie of this year as of now! Bring on Dune: Part Three as fast as possible!"," This is not a retelling of the original Road House"
"93","Dune: Part Two","davidmvining","7/10","1 March 2024","Denis Villeneuve's second half of his adaptation of Frank Herbert's Dune fully embraces the spectacle inherent in the material while also digging into the core implications that Herbert was exploring around power, cults of personality, and leadership. He flips some things around (I'm pretty sure), but otherwise delivers a handsome, exciting, second half to what he had started. And then he highlights Chani way too much, changing her character so much that she sticks out like a sore thumb to curious purposes that do little more than distract from what's going on around her. Seriously, if the final twenty seconds of this film were chopped off and lost in a fire, I'd actually be a good bit more positive on the film.Paul Atreides (Timothee Chalamet) and his mother the Lady Jessica (Rebecca Ferguson) have joined the Fremen led by Stilgar (Javier Barden). Paul grows close to Chani (Zendaya) who helps teach him the ways of the desert as they go into hiding from the dominant Harkonnen led by the Baron (Stellan Skarsgard), his elder nephew Rabban (Dave Bautista) left as governor of the desert planet Arrakis while the Baron continues to groom his younger nephew Feyd (Austin Butler) towards leadership. Operating as an exposition dump for those who didn't remember the first film is Irulan (Florence Pugh), nominally taking up her chronicling duties from the book (her entries marking the start of every chapter), while her father, the Emperor Shaddam IV (Christopher Walken), quietly ruminates on the implications of his plan to eradicate the Atreides perhaps failing.This is one of those stories that I know so well, that I kind of assume that everyone knows. And yet, Dune, for all it's popularity among scifi nerds, isn't the grand cultural touchpoint it's sometimes made out to be. Its influences are strong and wide, but the actual story knowledge isn't.Anyway, now's the time to talk about some creative choices. The first that screams out to me is how much more stylized visually the film is. The film opens with a scene of Harkonnen troops attacking the Fremen in the desert, and Villeneuve uses a partial eclipse as an excuse to bathe the entire scene in a deep orange. It's really nice to look at. I've been curious about the black and white segments in the trailers since I've seen them, and the explanation is that Geidi Prime has a black sun making it so that outside just looks like that. Knowing more from the books, I'd say that the whole Harkonnen look is something I'd attribute more to the Bene Tlielax, but it's at least interesting to see.There's a heavy emphasis on the Bene Gesserit and their breeding program in here, which I appreciate. I think that most heavily gets highlighted in the inclusion of Lady Margot Fenring (Lea Seydoux), a Bene Gesserit sent to Geidi Prime to seduce Feyd, secure his bloodline, and learn how to manipulate him should certain probabilities arise. She is very briefly seen in a modified form in the Sci-Fi Channel series, but otherwise she's never made an appearance in an adaptation. Although, unless Villeneuve is planning on using material from the sequel novels written by Brian Herbert (please no), Lady Fenring shouldn't be making any more appearances, making this feel like something of a dead end that still manages to provide some nice detail in terms of worldbuilding.And that leads me to the editing. I like how much detail gets brought in to help fill out the world (universe) of Dune, but there are some places where the film feels too fast. Take, for instance, the jump from Paul and Chani sitting on a dune watching a wormrider in the distance, Chani explaining to Paul that he'll never become a rider because he's not really Fremen. Cut ahead to about fifteen minutes later in screentime, there's been no mention of Paul training or anything, and now it's time for Paul to ride his first worm. Time has obviously passed, and this feels like the instance of a cut scene that was deemed unnecessary. However, considering how much time gets dedicated to Fenring's seduction of Feyd, it makes you wonder if the priorities were in total alignment when cutting the film down to its current length.So, Paul stays in the northern parts of Arrakis to lead the small revolt of the Fedaykin fighters against the Harkonnen while Jessica, pregnant and having become the Fremen's Reverend Mother through the changing of the Water of Life from poison into a harmless drink (no orgy in this mostly sexless adaptation), a process that awakens her unborn daughter, Alia, into consciousness. Gonna be honest, Jessica talking to Alia outloud is great. It's just the right kind of funny in this universe. Anyway, Jessica becomes a fanatic in the pursuit of Paul's legend as the Mahdi, the Lisan al-Gaib, the Voice from the Outer World, while Paul resists it. If I remember correctly, this is something of a complete reversal where Paul easily fell into the legend to help him fight while Jessica saw it as something of a survival mechanism, an unfortunate path she had to take to stay alive. I don't mind this change because Furgeson as a madwoman is great to watch.Things escalate. The Emperor must come to Arrakis. There is a showdown, and that showdown is great. It reminded me of the epic ending to James Cameron's Avatar, a movie I have no great love for but which, I cannot deny, has a freaking awesome final act action sequence. Atomics, worms, giant spaceships, it all comes together in an action and special effects extravaganza that Villeneuve manages with aplomb. It's great fun.Now, Chani. Chani is given extra prominence, and I really don't like how they did it. She is one of the Fremen who does not believe in the Lisan al-Gaib, and she sticks to that belief through everything she witnesses. As Paul is presenting all of the signs, as Chani herself is becoming part of the prophecy that she rejects through literal actions, she not only resists, but she fights back against it. It's so out of place, and it goes through to the end of the film. Sure, Herbert having Chani blithely accept that the love of her life is going to marry an imperial princess for power was always a bit thin, but turning the ending of the film into watching her pouting is just wrong.The story of Dune is Paul going from boy to man to leader to godhead. It's not Chani being mad that Paul is going from boy to man to leader to godhead. Ending on her was a mistake.Anyway, it's a spectacle. I think it gets the heart of Herbert's message right. It mixes things up to some degree and to not entirely successful effect. As an adaptation of Dune, I think the Sci-Fi miniseries is probably the best, but as a filmed experience, this is the more exciting and complete of the three attempts."," As good as it gets"
"94","Dune: Part Two","Eb04","9/10","26 February 2024","I just watched this in IMAX and it was one of the greatest movie experiences I have ever had. Everything from part one was done even better in part two and the story was much more interesting. The outfits were so unique and really well made. Whenever I thought it was starting to move a little slow something insane happens and I'm instantly drawn back into the world of dune that Denis has remade and expanded on so much. All the shots of the different worlds were just breathtaking. The last hour of the movie is by far some of the best made cinema in awhile and the action was so good. The last fight was awesome as well. ""You fought well Atreides."""," Do not mind the negative reviews; this was good ol' action flick FUN!"
"95","Dune: Part Two","Jason24321","10/10","2 March 2024","Frank Herbert's Dune is widely considered to be some of the most challenging science fiction material to adapt to the big screen. In 2021, Villeneuve hit it out of the park with Dune - Part One. In Part Two, he outdoes himself in every way. From cinematography to music to choreography to acting and dialogue, this movie had a mountain to climb to prove itself, and it did.With Hans Zimmer composing the score, it should surprise no one how well it compliments the film. Greig Fraser (Dune - Part One, The Creator, The Batman) was at the helm of cinematography, and really took my breath away with the magnificent vistas, incredible use of colours and even infrared, and expert capture of motion and scale. Fraser explains that they shot in digital, transposed to 35mm, then back to digital. This seemed absurd to me, until he explained that digital appeared too crisp for audiences, and film too nostalgic. His method obtained the perfect balance. I can't fault him for that, because I agree.The real risk here is of course the adaptation. How to retain some of the richest and most beloved science fiction lore in existence and condense it into the 2 hours and 46 minutes runtime. Villeneuve took a huge risk by splitting the first book into two parts. Had studios not green-lit part two, we would have been left with half a book. Unsatisfying for everyone. Thankfully the gamble paid off, and he was able to tell the epic story across two movies bordering on three hours. Even this required a brisk pace, with many notable scenes omitted. Despite this, I think Villeneuve retained the heart and soul of the story. He created two movies which appeal to both general audiences, and fans alike. There is so much to love here that I can't imagine anyone walking away feeling unsatisfied with the price of entry.See this on the biggest screen you can find. Then see it again. The visuals and score demand it. You will not be disappointed."," Yes, an 8"
"96","Dune: Part Two","movies_are_life_","6/10","5 March 2024","I want to love this movie. Despite being in a confused state throughout the film, I enjoyed what I was seeing visually. The lack of dialogue didn't work for me, although it's an aspect that would lessen the more I learned about the characters and world. I just don't get much of a chance at that within the movie. Despite my uninvolvement of the Dune world and its characters, I still have to be honest with the faults of the script and editing.Other than the overarching plot, scenes happen rather than you being lead into scenes via an emotional journey. The first hour is a back and forth of random tests and does she like him or not. Many characters simply appear in the movie, some deep into the runtime, including a main villain who has no discernible traits other than evil for the sake of it. Some characters appear very briefly and don't do much at all. The motivation of everyone was stripped out of the script. We see an abundant amount of screen time on someone riding a worm, but large battles will abrubtly end after very little setup. Did we need a large segment of screen time involving the nukes, when we could've just been told that there's nukes? The nuke scene feels as a standout filler sequence perhaps to be overshadow a few dozen moments of filler that could've been replaced with plot.I would challenge the praisers of this film to explain why everything was perfect. Austin Butler's character was great! Why? Because he was so one dimensional? The battles are the best! You mean snippets of battles that we got and one where it was hard to tell who was who. The score was amazing! Oh, the unbelievably overused bong noise that will randomly appear in the most tepid of scenes? Even the ""twist"" ending was foreshadowed in the first few minutes. This film is all spectacle with no emotional payoff. The number one praise that people will use to describe greatness of Dune 2 is the cinematography. This should be a leg that a great movie stands on, not the foundation. Although the direction and technicality of the look of Dune 2 is epic, the writing and editing are faulty. Maybe upon rewatches I would like it more since I might understand more of the details (after getting those details from other sources), but it's still nowhere as good as it could be or as most everyone seems to think it is."," It's good"
"97","Dune: Part Two","Sakaresm","7/10","2 March 2024","I mean, yeah, it's very entertaining and, of course, very visually stunning. The set pieces, the cinematography, the use of visual effects and lights, the sound design and music, all, absolutely amazing and almost literally stunning!But then? I'm not really seeing much after that. As I have not read the books, this movie was a total mystery to me. There's barely any dialog--at least not any that would explain anything what's going on at all. The world and the technology etc just doesn't make much sense to me.None of the characters are particularly interesting, to be honest. They don't really have that much personality to them, and even if they did, they didn't really make me care about them all that much.I don't know, I'm a bit conflicted, it wasn't a bad movie and, as I said, it was entertaining and visually mesmerizing, but it lacked the depth that I was expecting of a world this size and this rich with lore and history. Maybe the movie makers assumed everyone has read the books? As someone to who the world is not familiar at all, it just seems rather confusing and strange. I feel like they just focused on making it as visually awesome as they can (in which they arguably succeeded), but left the story on the pages of the books."," A movie worth watching"
"98","Dune: Part Two","JohnnyIMHO","7/10","3 March 2024","Lawrence of Arabia without the depth.The pacing was the problem.It was far too slow for the first 3/4 then rushed at the end.It meandered with little sense of what the point was at times.Chalamet just became a megalomaniac quite abruptly with very little development.And there was no surprise that he was going to become a messiah.His big challenge of riding a sand worm - ""the biggest ever seen"" (of course) - was predictably successfulWhy was Jessica chosen to be the Fremen mother superior when outsiders were so distrusted?Too little explanation, even though there was plenty of time to do so.Baron Harkonnen became quite ineffectual.The Emperor seemed a quite feeble old man.Where did his power come from?His fighters seemed quite average.He landed on the Arakkis and was defeated easily.I enjoyed Part 1 more because the characters were fresh and were more engaging.In Part 2 they seemed a little empty and caricatured. Part 2 seemed more of a grind.But, even so, I did enjoy it and will probably enjoy it more on 2nd watching.Zendaya was excellent.So was FergusonThe exploration of religion, fanaticism, freedom fighting vs terrorism, was interesting and unusual for a sci-fi movie. It does stand head and shoulders above most blockbusters.Of course, the visuals were stunning, as was the teeth-rattling sound.Although I admire the Director's more measured approach, i.e. Not just churning out a sequel, I'm not sure I'm excited enough for a part 3."," 2nd Hour!!!"
